{
  "$schema":"https://json-schema.org/draft/2020-12/schema",
  "title":"Service Excellence Task",
  "type":"object",
  "required":["task_id","objective"],
  "properties":{"task_id":{"type":"string"},"objective":{"type":"string"},"scope":{"type":"object","additionalProperties":true},"kpis":{"type":"array","items":{"type":"string"}},"regions":{"type":"array","items":{"type":"string"}},"functions":{"type":"array","items":{"type":"string"}},"time_period":{"type":["string","null"]},"available_sources":{"type":"array","items":{"type":"string"}},"constraints":{"type":"object","additionalProperties":true},"requested_output":{"type":["string","null"]}},
  "additionalProperties":false
}